{
  "$schema": "./engine-boundary.schema.json",
  "version": 1,
  "packageTarget": "com.nyx.gamecraft",
  "runtime": {
    "portableNow": [
      "GmAdaptiveSlot.cs",
      "GmAudioIntent.cs",
      "GmClearedPathGuide.cs",
      "GmCompositionCluster.cs",
      "GmCompositionElement.cs",
      "GmCompositionZone.cs",
      "GmEnvironmentalStoryIntent.cs",
      "GmLandscapeDepthIntent.cs",
      "GmLightIntent.cs",
      "GmLightingEngine.cs",
      "GmMotivatedLight.cs",
      "GmNegativeSpace.cs",
      "GmPacingIntent.cs",
      "GmPerceptualIntents.cs",
      "GmPropPlacementEngine.cs",
      "GmRepetitionIntent.cs",
      "GmReviewCompositionClaim.cs",
      "GmRouteReservation.cs",
      "GmRuntimeIntegrityPolicy.cs",
      "GmSceneAdaptiveIntent.cs",
      "GmSceneComposition.cs",
      "GmSoundscapeIntent.cs",
      "GmStyleIntent.cs",
      "GmSurfacePaletteIntent.cs"
    ],
    "adapterNeeded": [
      "GmAccessibilitySettings.cs",
      "GmAccessibilitySettingsView.cs",
      "GmAcousticZoneEngine.cs",
      "GmAmbientParticleAccessibility.cs",
      "GmAudioManager.cs",
      "GmDisplayCalibration.cs",
      "GmExperienceTelemetry.cs",
      "GmInteractionEngine.cs",
      "GmInteriorDustRuntime.cs",
      "GmRunSeed.cs",
      "GmSceneArrival.cs",
      "GmSceneCurtain.cs",
      "GmSceneIdentity.cs",
      "GmSceneReviewTour.cs",
      "GmSceneTransitionTrigger.cs",
      "GmSemanticActionExecutor.cs",
      "GmUiText.cs"
    ],
    "gameOwned": [
      "GmBonesController.cs",
      "GmBonesMatch.cs",
      "GmBonesRules.cs",
      "GmCreditsUI.cs",
      "GmEndingManager.cs",
      "GmEndingTrigger.cs",
      "GmEstateDoor.cs",
      "GmEstateKeyItem.cs",
      "GmFeelConfig.cs",
      "GmGameHud.cs",
      "GmHouseMemory.cs",
      "GmParlorAdaptation.cs",
      "GmParlorCore.cs",
      "GmParlorMatch.cs",
      "GmParlorMatchSnapshot.cs",
      "GmPauseMenu.cs",
      "GmReckoningSchedule.cs",
      "GmRunStore.cs",
      "GmSaveSystem.cs",
      "GmSceneDirector.cs",
      "GmSequenceExit.cs",
      "GmStudyController.cs",
      "GmStudyMatch.cs",
      "GmStudyRules.cs",
      "GmVillageSave.cs",
      "GmWagerMatch.cs",
      "GmWagerRules.cs",
      "GmWeightedShelf.cs"
    ]
  },
  "forbiddenPortableTerms": [
    "Aldric",
    "Court",
    "Debtor",
    "Estate",
    "Games Master",
    "HiddenRoom",
    "House",
    "Labyrinth",
    "Parlor",
    "Reckoning",
    "Shard",
    "ShutTheBox",
    "Village",
    "Wend"
  ]
}
